enviro_data_with_distance.csv

Timestamp,City,Latitude,Longitude,PM2.5,PM10,NO2,CO,SO2,O3,Temperature (°C),Humidity (%),Wind Speed (m/s),Wind Direction (°),Dist_Road,Dist_Industrial,Dist_Farmland,Source
2026-03-25 22:45:45,Delhi,28.6139,77.209,39.66,73.66,29.64,611.62,4.21,27.72,28.06,39,1.03,0,1.1921080360693412,0.0,0.0,Vehicular
2026-03-25 22:45:48,Mumbai,19.076,72.8777,31.64,50.99,1.13,172.65,4.65,106.31,30.03,62,3.09,350,5.681363834641796,43.10080771210865,1985.8723956258648,Natural
2026-03-25 22:45:51,Chennai,13.0827,80.2707,14.24,23.62,6.96,283.83,2.03,40.97,28.11,78,3.09,120,2.463478683331765,430.7492765061328,0.0,Natural
2026-03-25 22:45:54,Kolkata,22.5726,88.3639,20.06,33.82,1.45,264.79,1.12,57.27,26.96,83,4.63,160,33.96316572469283,1277.015665827335,0.0,Natural
2026-03-25 22:45:57,Bangalore,12.9716,77.5946,32.65,41.28,7.04,264.74,7.27,94.48,25.75,53,10.73,112,3.6721317991466864,332.2206079297574,0.0,Industrial
2026-03-25 22:46:01,Hyderabad,17.385,78.4867,27.88,36.22,9.43,328.43,4.66,70.09,25.71,69,2.57,130,13.528878432280315,2474.951488049587,530.9180966115073,Agricultural
2026-03-25 22:46:10,Delhi,28.6139,77.209,39.66,73.66,29.64,611.62,4.21,27.72,28.07,39,1.03,0,1.1921080360693412,0.0,0.0,Vehicular
2026-03-25 22:46:14,Mumbai,19.076,72.8777,31.64,50.99,1.13,172.65,4.65,106.31,30.03,62,3.09,350,5.681363834641796,43.10080771210865,1985.8723956258648,Natural
2026-03-25 22:46:18,Chennai,13.0827,80.2707,14.24,23.62,6.96,283.83,2.03,40.97,28.11,78,3.09,120,2.463478683331765,430.7492765061328,0.0,Natural
2026-03-25 22:46:22,Kolkata,22.5726,88.3639,20.06,33.82,1.45,264.79,1.12,57.27,26.96,83,4.63,160,33.96316572469283,1277.015665827335,0.0,Natural
2026-03-25 22:46:26,Bangalore,12.9716,77.5946,32.65,41.28,7.04,264.74,7.27,94.48,25.75,53,10.73,112,3.6721317991466864,332.2206079297574,0.0,Industrial
2026-03-25 22:46:30,Hyderabad,17.385,78.4867,27.88,36.22,9.43,328.43,4.66,70.09,25.71,69,2.57,130,13.528878432280315,2474.951488049587,530.9180966115073,Agricultural
2026-03-25 22:46:38,Delhi,28.6139,77.209,39.66,73.66,29.64,611.62,4.21,27.72,28.07,39,1.03,0,1.1921080360693412,0.0,0.0,Vehicular
2026-03-25 22:46:41,Mumbai,19.076,72.8777,31.64,50.99,1.13,172.65,4.65,106.31,30.03,62,3.09,350,5.681363834641796,43.10080771210865,1985.8723956258648,Natural
2026-03-25 22:46:45,Chennai,13.0827,80.2707,14.24,23.62,6.96,283.83,2.03,40.97,28.11,78,3.09,120,2.463478683331765,430.7492765061328,0.0,Natural
2026-03-25 22:46:48,Kolkata,22.5726,88.3639,20.06,33.82,1.45,264.79,1.12,57.27,26.96,83,4.63,160,33.96316572469283,1277.015665827335,0.0,Natural
2026-03-25 22:46:52,Bangalore,12.9716,77.5946,32.65,41.28,7.04,264.74,7.27,94.48,25.75,53,10.73,112,3.6721317991466864,332.2206079297574,0.0,Industrial
2026-03-25 22:46:55,Hyderabad,17.385,78.4867,27.88,36.22,9.43,328.43,4.66,70.09,25.71,69,2.57,130,13.528878432280315,2474.951488049587,530.9180966115073,Agricultural
2026-03-25 22:47:04,Delhi,28.6139,77.209,39.66,73.66,29.64,611.62,4.21,27.72,28.07,39,1.03,0,1.1921080360693412,0.0,0.0,Vehicular
2026-03-25 22:47:08,Mumbai,19.076,72.8777,31.64,50.99,1.13,172.65,4.65,106.31,30.03,62,3.09,350,5.681363834641796,43.10080771210865,1985.8723956258648,Natural
2026-03-25 22:47:12,Chennai,13.0827,80.2707,14.24,23.62,6.96,283.83,2.03,40.97,28.11,78,3.09,120,2.463478683331765,430.7492765061328,0.0,Natural
2026-03-25 22:47:15,Kolkata,22.5726,88.3639,20.06,33.82,1.45,264.79,1.12,57.27,26.96,83,4.63,160,33.96316572469283,1277.015665827335,0.0,Natural
2026-03-25 22:47:18,Bangalore,12.9716,77.5946,32.65,41.28,7.04,264.74,7.27,94.48,25.75,53,10.73,112,3.6721317991466864,332.2206079297574,0.0,Industrial
2026-03-25 22:47:21,Hyderabad,17.385,78.4867,27.88,36.22,9.43,328.43,4.66,70.09,25.71,69,2.57,130,13.528878432280315,2474.951488049587,530.9180966115073,Agricultural
2026-03-25 22:47:30,Delhi,28.6139,77.209,39.66,73.66,29.64,611.62,4.21,27.72,28.07,39,1.03,0,1.1921080360693412,0.0,0.0,Vehicular
2026-03-25 22:47:33,Mumbai,19.076,72.8777,31.64,50.99,1.13,172.65,4.65,106.31,30.03,62,3.09,350,5.681363834641796,43.10080771210865,1985.8723956258648,Natural
2026-03-25 22:47:36,Chennai,13.0827,80.2707,14.24,23.62,6.96,283.83,2.03,40.97,28.11,78,3.09,120,2.463478683331765,430.7492765061328,0.0,Natural
2026-03-25 22:47:40,Kolkata,22.5726,88.3639,20.06,33.82,1.45,264.79,1.12,57.27,26.96,83,4.63,160,33.96316572469283,1277.015665827335,0.0,Natural
2026-03-25 22:47:43,Bangalore,12.9716,77.5946,32.65,41.28,7.04,264.74,7.27,94.48,25.75,53,10.73,112,3.6721317991466864,332.2206079297574,0.0,Industrial
2026-03-25 22:47:47,Hyderabad,17.385,78.4867,27.88,36.22,9.43,328.43,4.66,70.09,25.73,69,2.57,130,13.528878432280315,2474.951488049587,530.9180966115073,Agricultural
2026-03-25 22:47:56,Delhi,28.6139,77.209,39.66,73.66,29.64,611.62,4.21,27.72,28.07,39,1.03,0,1.1921080360693412,0.0,0.0,Vehicular
2026-03-25 22:47:59,Mumbai,19.076,72.8777,31.64,50.99,1.13,172.65,4.65,106.31,30.03,62,3.09,350,5.681363834641796,43.10080771210865,1985.8723956258648,Natural
2026-03-25 22:48:04,Chennai,13.0827,80.2707,14.24,23.62,6.96,283.83,2.03,40.97,28.11,78,3.09,120,2.463478683331765,430.7492765061328,0.0,Natural
2026-03-25 22:48:07,Kolkata,22.5726,88.3639,20.06,33.82,1.45,264.79,1.12,57.27,26.96,83,4.63,160,33.96316572469283,1277.015665827335,0.0,Natural
2026-03-25 22:48:10,Bangalore,12.9716,77.5946,32.65,41.28,7.04,264.74,7.27,94.48,25.75,53,10.73,112,3.6721317991466864,332.2206079297574,0.0,Industrial
2026-03-25 22:48:14,Hyderabad,17.385,78.4867,27.88,36.22,9.43,328.43,4.66,70.09,25.73,69,2.57,130,13.528878432280315,2474.951488049587,530.9180966115073,Agricultural
2026-03-25 22:48:22,Delhi,28.6139,77.209,39.66,73.66,29.64,611.62,4.21,27.72,28.07,39,1.03,0,1.1921080360693412,0.0,0.0,Vehicular
2026-03-25 22:48:26,Mumbai,19.076,72.8777,31.64,50.99,1.13,172.65,4.65,106.31,30.03,62,3.09,350,5.681363834641796,43.10080771210865,1985.8723956258648,Natural
2026-03-25 22:48:29,Chennai,13.0827,80.2707,14.24,23.62,6.96,283.83,2.03,40.97,28.11,78,3.09,120,2.463478683331765,430.7492765061328,0.0,Natural
2026-03-25 22:48:32,Kolkata,22.5726,88.3639,20.06,33.82,1.45,264.79,1.12,57.27,26.96,83,4.63,160,33.96316572469283,1277.015665827335,0.0,Natural
2026-03-25 22:48:36,Bangalore,12.9716,77.5946,32.65,41.28,7.04,264.74,7.27,94.48,25.75,53,10.73,112,3.6721317991466864,332.2206079297574,0.0,Industrial
2026-03-25 22:48:39,Hyderabad,17.385,78.4867,27.88,36.22,9.43,328.43,4.66,70.09,25.73,69,2.57,130,13.528878432280315,2474.951488049587,530.9180966115073,Agricultural
2026-03-25 22:48:48,Delhi,28.6139,77.209,39.66,73.66,29.64,611.62,4.21,27.72,28.07,39,1.03,0,1.1921080360693412,0.0,0.0,Vehicular
2026-03-25 22:48:52,Mumbai,19.076,72.8777,31.64,50.99,1.13,172.65,4.65,106.31,30.03,62,3.09,350,5.681363834641796,43.10080771210865,1985.8723956258648,Natural
2026-03-25 22:48:56,Chennai,13.0827,80.2707,14.24,23.62,6.96,283.83,2.03,40.97,28.11,78,3.09,120,2.463478683331765,430.7492765061328,0.0,Natural
2026-03-25 22:48:58,Kolkata,22.5726,88.3639,20.06,33.82,1.45,264.79,1.12,57.27,26.96,83,4.63,160,33.96316572469283,1277.015665827335,0.0,Natural
2026-03-25 22:49:01,Bangalore,12.9716,77.5946,32.65,41.28,7.04,264.74,7.27,94.48,25.75,53,10.73,112,3.6721317991466864,332.2206079297574,0.0,Industrial
2026-03-25 22:49:04,Hyderabad,17.385,78.4867,27.88,36.22,9.43,328.43,4.66,70.09,25.73,69,2.57,130,13.528878432280315,2474.951488049587,530.9180966115073,Agricultural
2026-03-25 22:49:12,Delhi,28.6139,77.209,39.66,73.66,29.64,611.62,4.21,27.72,28.07,39,1.03,0,1.1921080360693412,0.0,0.0,Vehicular
2026-03-25 22:49:16,Mumbai,19.076,72.8777,31.64,50.99,1.13,172.65,4.65,106.31,30.03,62,3.09,350,5.681363834641796,43.10080771210865,1985.8723956258648,Natural
2026-03-25 22:49:20,Chennai,13.0827,80.2707,14.24,23.62,6.96,283.83,2.03,40.97,28.11,78,3.09,120,2.463478683331765,430.7492765061328,0.0,Natural
2026-03-25 22:49:23,Kolkata,22.5726,88.3639,20.06,33.82,1.45,264.79,1.12,57.27,26.96,83,4.63,160,33.96316572469283,1277.015665827335,0.0,Natural
2026-03-25 22:49:29,Bangalore,12.9716,77.5946,32.65,41.28,7.04,264.74,7.27,94.48,25.75,53,10.73,112,3.6721317991466864,332.2206079297574,0.0,Industrial
2026-03-25 22:49:31,Hyderabad,17.385,78.4867,27.88,36.22,9.43,328.43,4.66,70.09,25.73,69,2.57,130,13.528878432280315,2474.951488049587,530.9180966115073,Agricultural
2026-03-25 22:49:39,Delhi,28.6139,77.209,39.66,73.66,29.64,611.62,4.21,27.72,28.07,39,1.03,0,1.1921080360693412,0.0,0.0,Vehicular
2026-03-25 22:49:42,Mumbai,19.076,72.8777,31.64,50.99,1.13,172.65,4.65,106.31,30.03,62,3.09,350,5.681363834641796,43.10080771210865,1985.8723956258648,Natural
2026-03-25 22:49:44,Chennai,13.0827,80.2707,14.24,23.62,6.96,283.83,2.03,40.97,28.11,78,3.09,120,2.463478683331765,430.7492765061328,0.0,Natural
2026-03-25 22:49:47,Kolkata,22.5726,88.3639,20.06,33.82,1.45,264.79,1.12,57.27,26.96,83,4.63,160,33.96316572469283,1277.015665827335,0.0,Natural
2026-03-25 22:49:51,Bangalore,12.9716,77.5946,32.65,41.28,7.04,264.74,7.27,94.48,25.75,53,10.73,112,3.6721317991466864,332.2206079297574,0.0,Industrial
2026-03-25 22:49:54,Hyderabad,17.385,78.4867,27.88,36.22,9.43,328.43,4.66,70.09,25.73,69,2.57,130,13.528878432280315,2474.951488049587,530.9180966115073,Agricultural

README.md

# EnviroScan-AI

cities = [
    {"name": "Delhi", "lat": 28.6139, "lon": 77.2090},
    {"name": "Mumbai", "lat": 19.0760, "lon": 72.8777},
    {"name": "Chennai", "lat": 13.0827, "lon": 80.2707},
    {"name": "Kolkata", "lat": 22.5726, "lon": 88.3639},
    {"name": "Bangalore", "lat": 12.9716, "lon": 77.5946},
    {"name": "Hyderabad", "lat": 17.3850, "lon": 78.4867},
]